{
  "path": "layers/knowledge/auth.toml",
  "name": "auth.toml",
  "type": "toml",
  "content": {
    "topic": {
      "id": "auth",
      "name": "Authentication & Authorization",
      "description": "Phone-based authentication with SMS OTP"
    },
    "facts": [
      {
        "question": "How does authentication work?",
        "answer": "Phone number authentication with SMS verification. User enters phone number, receives 6-digit code via SMS, enters code to log in.",
        "tags": [
          "auth",
          "otp",
          "phone"
        ],
        "status": "verified"
      },
      {
        "question": "What is the authentication flow?",
        "answer": "1. User enters phone number (Israeli format: 05x-xxx-xxxx)\n2. System generates 6-digit code and sends via SMS provider\n3. User enters received code\n4. System validates code, creates session, returns auth token\n5. User redirected to app home screen\n",
        "tags": [
          "auth",
          "flow",
          "otp"
        ],
        "status": "verified"
      },
      {
        "question": "What are OTP restrictions?",
        "answer": "Code valid for 5 minutes. Rate limit: 3 send attempts per phone per 15 minutes. Session valid for 30 days.",
        "tags": [
          "auth",
          "security",
          "otp"
        ],
        "status": "verified"
      },
      {
        "question": "How are roles structured?",
        "answer": "Three roles with hierarchy: guest (0) < user (1) < admin (2). Each role has specific permissions defined in roles config.",
        "tags": [
          "auth",
          "roles"
        ],
        "status": "verified"
      },
      {
        "question": "What guards are available?",
        "answer": "AuthGuard (must be logged in), GuestGuard (must NOT be logged in), RoleGuard (requires specific role), PermissionGuard (requires specific permission)",
        "tags": [
          "auth",
          "guards"
        ],
        "status": "verified"
      },
      {
        "question": "How does route protection work?",
        "answer": "Routes have meta with access type: public, guest, authenticated, or role. RouteGuard component wraps routes and applies appropriate guard.",
        "tags": [
          "auth",
          "routing"
        ],
        "status": "verified"
      }
    ]
  },
  "rawContent": "# Authentication Knowledge Base\n\n[topic]\nid = \"auth\"\nname = \"Authentication & Authorization\"\ndescription = \"Phone-based authentication with SMS OTP\"\n\n[[facts]]\nquestion = \"How does authentication work?\"\nanswer = \"Phone number authentication with SMS verification. User enters phone number, receives 6-digit code via SMS, enters code to log in.\"\ntags = [\"auth\", \"otp\", \"phone\"]\nstatus = \"verified\"\n\n[[facts]]\nquestion = \"What is the authentication flow?\"\nanswer = \"\"\"\n1. User enters phone number (Israeli format: 05x-xxx-xxxx)\n2. System generates 6-digit code and sends via SMS provider\n3. User enters received code\n4. System validates code, creates session, returns auth token\n5. User redirected to app home screen\n\"\"\"\ntags = [\"auth\", \"flow\", \"otp\"]\nstatus = \"verified\"\n\n[[facts]]\nquestion = \"What are OTP restrictions?\"\nanswer = \"Code valid for 5 minutes. Rate limit: 3 send attempts per phone per 15 minutes. Session valid for 30 days.\"\ntags = [\"auth\", \"security\", \"otp\"]\nstatus = \"verified\"\n\n[[facts]]\nquestion = \"How are roles structured?\"\nanswer = \"Three roles with hierarchy: guest (0) < user (1) < admin (2). Each role has specific permissions defined in roles config.\"\ntags = [\"auth\", \"roles\"]\nstatus = \"verified\"\n\n[[facts]]\nquestion = \"What guards are available?\"\nanswer = \"AuthGuard (must be logged in), GuestGuard (must NOT be logged in), RoleGuard (requires specific role), PermissionGuard (requires specific permission)\"\ntags = [\"auth\", \"guards\"]\nstatus = \"verified\"\n\n[[facts]]\nquestion = \"How does route protection work?\"\nanswer = \"Routes have meta with access type: public, guest, authenticated, or role. RouteGuard component wraps routes and applies appropriate guard.\"\ntags = [\"auth\", \"routing\"]\nstatus = \"verified\"\n",
  "metadata": {
    "size": 1733,
    "modified": "2025-12-15T07:54:39.658Z"
  }
}