{
  "path": "interview.toml",
  "name": "interview.toml",
  "type": "toml",
  "content": {
    "meta": {
      "projectName": "ElderCare",
      "startedAt": "2025-01-14",
      "completedAt": ""
    },
    "assessment": {
      "projectType": "mobile",
      "projectStage": "idea",
      "dataComplexity": "relational",
      "rolesCount": "2-3",
      "integrationsLevel": "few-apis",
      "platforms": "multiplatform",
      "platformList": [
        "client-app",
        "specialist-app",
        "admin-app"
      ],
      "appSides": "single",
      "appSidesList": [],
      "existingCodebase": false,
      "techConstraints": [
        "React",
        "Mobile-first"
      ]
    },
    "discovery": {
      "problem": "Manual handling of elderly care orders via phone/messages creates operational overhead and makes it difficult to track orders, specialist availability, and working hours",
      "audience": "Families needing elderly care services in Israel, care specialists, and company administrators",
      "coreValue": "Simple digital platform for ordering and managing elderly care services with real-time tracking",
      "keyFeatures": [
        "Easy service ordering without mandatory registration",
        "Phone-based client identification",
        "Specialist assignment and availability management",
        "Real-time order status tracking",
        "Work time recording and tracking"
      ],
      "inScope": [
        "Service ordering (client app)",
        "Order status tracking",
        "Specialist work time recording",
        "Availability management",
        "SMS notifications",
        "Order history",
        "Basic reviews"
      ],
      "outOfScope": [
        "Online payments",
        "Complex financial/accounting",
        "Real-time GPS tracking",
        "Chat functionality",
        "Multi-language (MVP in Hebrew/English)"
      ],
      "successMetrics": [
        "Orders processed through app",
        "Reduced phone call volume",
        "Accurate time tracking"
      ],
      "constraints": "Israel market, Hebrew RTL support, SMS-based verification",
      "existingSystems": [],
      "compliance": [],
      "scale": "",
      "stakeholders": "",
      "aiIntegration": false,
      "aiProvider": "",
      "aiFeatures": []
    },
    "design": {
      "approach": "ui-kit",
      "colorScheme": "Blue/teal professional healthcare theme",
      "darkMode": false,
      "brandGuidelines": false,
      "uiReferences": [],
      "responsive": "mobile-first",
      "accessibilityTarget": "wcag-aa",
      "primaryLanguage": "he",
      "additionalLanguages": [
        "en"
      ],
      "rtlSupport": true,
      "prototypeLanguage": "en"
    },
    "access": {
      "authModel": "mixed",
      "publicParts": [
        "order-form",
        "order-tracking"
      ],
      "authMethods": [
        "phone"
      ],
      "phoneFormat": "single-country",
      "socialAuth": [],
      "userTypes": [
        "client",
        "specialist",
        "admin"
      ],
      "rolePermissions": "Client: Create orders, view own orders, track status, leave reviews\nSpecialist: View assigned orders, mark work start/end, set availability\nAdmin: Full access - manage orders, specialists, assignments, view all data\n",
      "protectedPages": [
        "specialist-dashboard",
        "admin-panel"
      ],
      "roleHierarchy": "",
      "permissionGranularity": "page",
      "multiTenant": "none",
      "guestFlows": "Clients can order without registration, identified by phone"
    },
    "data": {
      "mainEntities": [
        "User",
        "Client",
        "Specialist",
        "Admin",
        "Order",
        "Service",
        "City",
        "Availability",
        "Review",
        "Notification",
        "OtpCode",
        "OrderEvent"
      ],
      "entityFields": "User: id, email, password, name, avatar, role (USER|ADMIN|SPECIALIST|CLIENT), isActive, createdAt, updatedAt\nClient: id, userId?, phone, name?, city?, address?, createdAt, updatedAt\nSpecialist: id, userId?, phone, name, email?, avatar?, isActive, rating, reviewCount, createdAt, updatedAt\nAdmin: id, userId, createdAt\nOrder: id, orderNumber, clientId, serviceId, specialistId?, cityId, clientPhone, clientName?, address, addressNotes?, date, startTime, duration?, status (CREATED|REVIEWING|ASSIGNED|ON_WAY|IN_PROGRESS|COMPLETED|PAID|CANCELLED), notes?, actualStart?, actualEnd?, estimatedPrice?, finalPrice?, paidAmount?, paidAt?, paymentNotes?, createdAt, updatedAt\nService: id, code, name, description, category (CARE|MEDICAL|HOUSEHOLD|TRANSPORT), icon?, isActive, sortOrder\nCity: id, name, region?, isActive, sortOrder\nAvailability: id, specialistId, date, startTime, endTime, isBooked\nReview: id, orderId, clientId, rating (1-5), comment?\nNotification: id, userId, type, title, message, data?, isRead\nOtpCode: id, phone, code, expiresAt, isUsed\nOrderEvent: id, orderId, status, note?, createdAt, createdBy?\n",
      "relationships": "User -> Client (one-to-one optional)\nUser -> Specialist (one-to-one optional)\nUser -> Admin (one-to-one optional)\nUser -> Session (one-to-many)\nUser -> Notification (one-to-many)\nClient -> Order (one-to-many)\nClient -> Review (one-to-many)\nSpecialist -> SpecialistServiceType -> Service (many-to-many via junction)\nSpecialist -> SpecialistCity -> City (many-to-many via junction)\nSpecialist -> Availability (one-to-many)\nSpecialist -> Order (one-to-many)\nService -> Order (one-to-many)\nCity -> Order (one-to-many)\nOrder -> Review (one-to-one)\nOrder -> OrderEvent (one-to-many, audit history)\n",
      "requiredFields": "Order: clientId, serviceId, cityId, clientPhone, address, date, startTime",
      "validationRules": "Phone: Israeli format, Date: future dates only, Rating: 1-5",
      "filesAndMedia": "none",
      "search": "basic",
      "softDelete": false,
      "importExport": "none",
      "fieldPermissions": "",
      "auditTrails": "OrderEvent tracks all status changes",
      "dataLifecycle": "CREATED -> REVIEWING -> ASSIGNED -> ON_WAY -> IN_PROGRESS -> COMPLETED -> PAID",
      "retentionPolicy": "",
      "schemaFile": "src/prisma/schema.prisma"
    },
    "features": {
      "screens": [
        "ClientHome",
        "OrderForm",
        "OrderTracking",
        "OrderHistory",
        "ReviewForm",
        "SpecialistHome",
        "SpecialistOrders",
        "ActiveShift",
        "AvailabilitySetup",
        "AdminDashboard",
        "AdminOrders",
        "AdminSpecialists",
        "SpecialistDetail",
        "OrderAssignment"
      ],
      "navigationMap": "Client App: Home -> OrderForm, OrderTracking, OrderHistory\nSpecialist App: Home -> Orders, ActiveShift, Availability (bottom nav)\nAdmin App: Dashboard, Orders, Specialists (bottom nav)\n",
      "primaryUserJourney": "1. Client opens app -> fills order form (phone, service, location, date)\n2. Order created -> SMS confirmation\n3. Admin reviews -> assigns specialist\n4. Specialist sees order -> goes to location\n5. Specialist marks start -> work in progress\n6. Specialist marks end -> shift completed\n7. Client can track status anytime\n8. Client leaves review after completion\n",
      "userStories": "As a client, I want to order care services easily without creating an account\nAs a client, I want to track my order status in real-time\nAs a specialist, I want to see my assigned orders and mark work progress\nAs a specialist, I want to set my availability for the week\nAs an admin, I want to see all orders and assign specialists\nAs an admin, I want to manage specialists and their service areas\n",
      "errorHandling": "Toast notifications for errors, form validation",
      "emptyStates": "No orders yet, No specialists available",
      "loadingStates": "Skeleton loaders",
      "offlineBehavior": "",
      "notifications": "push",
      "settingsPage": false,
      "analyticsEvents": [
        "order.created",
        "order.assigned",
        "shift.started",
        "shift.completed"
      ]
    },
    "modules": {
      "domains": [],
      "moduleBoundaries": "",
      "interfaces": "",
      "sharedComponents": []
    }
  },
  "rawContent": "# Interview Answers\n# ================================================\n# ElderCare - Elderly Care Services Platform\n# ================================================\n\n[meta]\nprojectName = \"ElderCare\"\nstartedAt = \"2025-01-14\"\ncompletedAt = \"\"\n\n# ─────────────────────────────────────────────────\n# Phase 0: Assessment\n# ─────────────────────────────────────────────────\n[assessment]\nprojectType = \"mobile\"\nprojectStage = \"idea\"\ndataComplexity = \"relational\"\nrolesCount = \"2-3\"  # client, specialist, admin\nintegrationsLevel = \"few-apis\"  # SMS notifications\nplatforms = \"multiplatform\"\nplatformList = [\"client-app\", \"specialist-app\", \"admin-app\"]\nappSides = \"single\"\nappSidesList = []\nexistingCodebase = false\ntechConstraints = [\"React\", \"Mobile-first\"]\n\n# ─────────────────────────────────────────────────\n# Phase 1: Discovery\n# ─────────────────────────────────────────────────\n[discovery]\nproblem = \"Manual handling of elderly care orders via phone/messages creates operational overhead and makes it difficult to track orders, specialist availability, and working hours\"\naudience = \"Families needing elderly care services in Israel, care specialists, and company administrators\"\ncoreValue = \"Simple digital platform for ordering and managing elderly care services with real-time tracking\"\nkeyFeatures = [\n  \"Easy service ordering without mandatory registration\",\n  \"Phone-based client identification\",\n  \"Specialist assignment and availability management\",\n  \"Real-time order status tracking\",\n  \"Work time recording and tracking\"\n]\ninScope = [\n  \"Service ordering (client app)\",\n  \"Order status tracking\",\n  \"Specialist work time recording\",\n  \"Availability management\",\n  \"SMS notifications\",\n  \"Order history\",\n  \"Basic reviews\"\n]\noutOfScope = [\n  \"Online payments\",\n  \"Complex financial/accounting\",\n  \"Real-time GPS tracking\",\n  \"Chat functionality\",\n  \"Multi-language (MVP in Hebrew/English)\"\n]\nsuccessMetrics = [\n  \"Orders processed through app\",\n  \"Reduced phone call volume\",\n  \"Accurate time tracking\"\n]\nconstraints = \"Israel market, Hebrew RTL support, SMS-based verification\"\nexistingSystems = []\ncompliance = []\nscale = \"\"\nstakeholders = \"\"\naiIntegration = false\naiProvider = \"\"\naiFeatures = []\n\n# ─────────────────────────────────────────────────\n# Phase 2: Design\n# ─────────────────────────────────────────────────\n[design]\napproach = \"ui-kit\"\ncolorScheme = \"Blue/teal professional healthcare theme\"\ndarkMode = false\nbrandGuidelines = false\nuiReferences = []\nresponsive = \"mobile-first\"\naccessibilityTarget = \"wcag-aa\"  # Important for elderly users\nprimaryLanguage = \"he\"\nadditionalLanguages = [\"en\"]\nrtlSupport = true\nprototypeLanguage = \"en\"  # Prototype in English for development\n\n# ─────────────────────────────────────────────────\n# Phase 3: Access\n# ─────────────────────────────────────────────────\n[access]\nauthModel = \"mixed\"\npublicParts = [\"order-form\", \"order-tracking\"]\nauthMethods = [\"phone\"]\nphoneFormat = \"single-country\"  # Israel +972\nsocialAuth = []\nuserTypes = [\"client\", \"specialist\", \"admin\"]\nrolePermissions = \"\"\"\nClient: Create orders, view own orders, track status, leave reviews\nSpecialist: View assigned orders, mark work start/end, set availability\nAdmin: Full access - manage orders, specialists, assignments, view all data\n\"\"\"\nprotectedPages = [\"specialist-dashboard\", \"admin-panel\"]\nroleHierarchy = \"\"\npermissionGranularity = \"page\"\nmultiTenant = \"none\"\nguestFlows = \"Clients can order without registration, identified by phone\"\n\n# ─────────────────────────────────────────────────\n# Phase 4: Data Model\n# ─────────────────────────────────────────────────\n[data]\nmainEntities = [\"User\", \"Client\", \"Specialist\", \"Admin\", \"Order\", \"Service\", \"City\", \"Availability\", \"Review\", \"Notification\", \"OtpCode\", \"OrderEvent\"]\nentityFields = \"\"\"\nUser: id, email, password, name, avatar, role (USER|ADMIN|SPECIALIST|CLIENT), isActive, createdAt, updatedAt\nClient: id, userId?, phone, name?, city?, address?, createdAt, updatedAt\nSpecialist: id, userId?, phone, name, email?, avatar?, isActive, rating, reviewCount, createdAt, updatedAt\nAdmin: id, userId, createdAt\nOrder: id, orderNumber, clientId, serviceId, specialistId?, cityId, clientPhone, clientName?, address, addressNotes?, date, startTime, duration?, status (CREATED|REVIEWING|ASSIGNED|ON_WAY|IN_PROGRESS|COMPLETED|PAID|CANCELLED), notes?, actualStart?, actualEnd?, estimatedPrice?, finalPrice?, paidAmount?, paidAt?, paymentNotes?, createdAt, updatedAt\nService: id, code, name, description, category (CARE|MEDICAL|HOUSEHOLD|TRANSPORT), icon?, isActive, sortOrder\nCity: id, name, region?, isActive, sortOrder\nAvailability: id, specialistId, date, startTime, endTime, isBooked\nReview: id, orderId, clientId, rating (1-5), comment?\nNotification: id, userId, type, title, message, data?, isRead\nOtpCode: id, phone, code, expiresAt, isUsed\nOrderEvent: id, orderId, status, note?, createdAt, createdBy?\n\"\"\"\nrelationships = \"\"\"\nUser -> Client (one-to-one optional)\nUser -> Specialist (one-to-one optional)\nUser -> Admin (one-to-one optional)\nUser -> Session (one-to-many)\nUser -> Notification (one-to-many)\nClient -> Order (one-to-many)\nClient -> Review (one-to-many)\nSpecialist -> SpecialistServiceType -> Service (many-to-many via junction)\nSpecialist -> SpecialistCity -> City (many-to-many via junction)\nSpecialist -> Availability (one-to-many)\nSpecialist -> Order (one-to-many)\nService -> Order (one-to-many)\nCity -> Order (one-to-many)\nOrder -> Review (one-to-one)\nOrder -> OrderEvent (one-to-many, audit history)\n\"\"\"\nrequiredFields = \"Order: clientId, serviceId, cityId, clientPhone, address, date, startTime\"\nvalidationRules = \"Phone: Israeli format, Date: future dates only, Rating: 1-5\"\nfilesAndMedia = \"none\"\nsearch = \"basic\"\nsoftDelete = false\nimportExport = \"none\"\nfieldPermissions = \"\"\nauditTrails = \"OrderEvent tracks all status changes\"\ndataLifecycle = \"CREATED -> REVIEWING -> ASSIGNED -> ON_WAY -> IN_PROGRESS -> COMPLETED -> PAID\"\nretentionPolicy = \"\"\nschemaFile = \"src/prisma/schema.prisma\"\n\n# ─────────────────────────────────────────────────\n# Phase 5: Features & Screens\n# ─────────────────────────────────────────────────\n[features]\nscreens = [\n  \"ClientHome\",\n  \"OrderForm\",\n  \"OrderTracking\",\n  \"OrderHistory\",\n  \"ReviewForm\",\n  \"SpecialistHome\",\n  \"SpecialistOrders\",\n  \"ActiveShift\",\n  \"AvailabilitySetup\",\n  \"AdminDashboard\",\n  \"AdminOrders\",\n  \"AdminSpecialists\",\n  \"SpecialistDetail\",\n  \"OrderAssignment\"\n]\nnavigationMap = \"\"\"\nClient App: Home -> OrderForm, OrderTracking, OrderHistory\nSpecialist App: Home -> Orders, ActiveShift, Availability (bottom nav)\nAdmin App: Dashboard, Orders, Specialists (bottom nav)\n\"\"\"\nprimaryUserJourney = \"\"\"\n1. Client opens app -> fills order form (phone, service, location, date)\n2. Order created -> SMS confirmation\n3. Admin reviews -> assigns specialist\n4. Specialist sees order -> goes to location\n5. Specialist marks start -> work in progress\n6. Specialist marks end -> shift completed\n7. Client can track status anytime\n8. Client leaves review after completion\n\"\"\"\nuserStories = \"\"\"\nAs a client, I want to order care services easily without creating an account\nAs a client, I want to track my order status in real-time\nAs a specialist, I want to see my assigned orders and mark work progress\nAs a specialist, I want to set my availability for the week\nAs an admin, I want to see all orders and assign specialists\nAs an admin, I want to manage specialists and their service areas\n\"\"\"\nerrorHandling = \"Toast notifications for errors, form validation\"\nemptyStates = \"No orders yet, No specialists available\"\nloadingStates = \"Skeleton loaders\"\nofflineBehavior = \"\"\nnotifications = \"push\"  # SMS in real implementation\nsettingsPage = false\nanalyticsEvents = [\"order.created\", \"order.assigned\", \"shift.started\", \"shift.completed\"]\n\n# ─────────────────────────────────────────────────\n# Phase 6: Modules (complex only) - SKIPPED\n# ─────────────────────────────────────────────────\n[modules]\ndomains = []\nmoduleBoundaries = \"\"\ninterfaces = \"\"\nsharedComponents = []\n",
  "metadata": {
    "size": 9391,
    "modified": "2025-12-14T19:43:06.815Z"
  }
}