{
  "path": "layers/project/about.toml",
  "name": "about.toml",
  "type": "toml",
  "content": {
    "project": {
      "id": "eldercare",
      "name": "ElderCare",
      "description": "Digital platform for ordering and managing elderly care services in Israel",
      "type": "mobile",
      "version": "0.1.0",
      "problem": {
        "statement": "Manual handling of care orders via phone creates operational overhead",
        "impact": "Difficult to track orders, specialist availability, and working hours"
      },
      "solution": {
        "summary": "Simple mobile apps for clients, specialists, and admins",
        "coreValue": "Easy ordering without registration, real-time tracking, efficient management"
      },
      "audience": {
        "primary": "Families needing elderly care services",
        "secondary": [
          "Care specialists",
          "Company administrators"
        ],
        "market": "Israel"
      },
      "scope": {
        "inScope": [
          "Client mobile app",
          "Specialist mobile app",
          "Admin mobile app",
          "Order lifecycle management",
          "Availability scheduling"
        ],
        "outOfScope": [
          "Payment processing",
          "Complex accounting",
          "GPS tracking",
          "In-app messaging"
        ]
      },
      "platforms": {
        "list": [
          "client-app",
          "specialist-app",
          "admin-app"
        ],
        "shared": [
          "entities",
          "services",
          "components"
        ]
      }
    },
    "features": {
      "list": [
        "Service ordering without mandatory registration",
        "Phone-based client identification",
        "Order status tracking",
        "Specialist work time recording",
        "Availability management",
        "SMS notifications (simulated)"
      ]
    },
    "owner": {
      "name": "ElderCare Team",
      "email": "team@eldercare.il"
    }
  },
  "rawContent": "# ElderCare - Project Definition\n# Elderly care services platform for Israel\n\n[project]\nid = \"eldercare\"\nname = \"ElderCare\"\ndescription = \"Digital platform for ordering and managing elderly care services in Israel\"\ntype = \"mobile\"\nversion = \"0.1.0\"\n\n[project.problem]\nstatement = \"Manual handling of care orders via phone creates operational overhead\"\nimpact = \"Difficult to track orders, specialist availability, and working hours\"\n\n[project.solution]\nsummary = \"Simple mobile apps for clients, specialists, and admins\"\ncoreValue = \"Easy ordering without registration, real-time tracking, efficient management\"\n\n[project.audience]\nprimary = \"Families needing elderly care services\"\nsecondary = [\"Care specialists\", \"Company administrators\"]\nmarket = \"Israel\"\n\n[features]\nlist = [\n  \"Service ordering without mandatory registration\",\n  \"Phone-based client identification\",\n  \"Order status tracking\",\n  \"Specialist work time recording\",\n  \"Availability management\",\n  \"SMS notifications (simulated)\"\n]\n\n[project.scope]\ninScope = [\n  \"Client mobile app\",\n  \"Specialist mobile app\",\n  \"Admin mobile app\",\n  \"Order lifecycle management\",\n  \"Availability scheduling\"\n]\noutOfScope = [\n  \"Payment processing\",\n  \"Complex accounting\",\n  \"GPS tracking\",\n  \"In-app messaging\"\n]\n\n[project.platforms]\nlist = [\"client-app\", \"specialist-app\", \"admin-app\"]\nshared = [\"entities\", \"services\", \"components\"]\n\n[owner]\nname = \"ElderCare Team\"\nemail = \"team@eldercare.il\"\n",
  "metadata": {
    "size": 1451,
    "modified": "2025-12-14T14:11:14.094Z"
  }
}