{
  "path": "layers/roles/eldercare-admin.toml",
  "name": "eldercare-admin.toml",
  "type": "toml",
  "content": {
    "role": {
      "id": "eldercare-admin",
      "name": "Administrator",
      "description": "Company administrators managing orders and specialists",
      "level": 3,
      "identification": {
        "method": "phone",
        "required": true,
        "verification": "sms-otp"
      },
      "actions": {
        "canDo": [
          "View all orders",
          "Assign specialists to orders",
          "Create and manage specialists",
          "Activate/deactivate specialists",
          "Define specialist service areas",
          "View dashboard metrics",
          "View specialist availability"
        ],
        "cannotDo": [
          "Delete orders permanently",
          "Access financial/accounting",
          "Modify system settings"
        ]
      }
    },
    "permissions": {
      "list": [
        "order:read:all",
        "order:assign",
        "order:update",
        "specialist:create",
        "specialist:read:all",
        "specialist:update",
        "specialist:activate",
        "specialist:deactivate",
        "availability:read:all",
        "dashboard:view"
      ]
    },
    "relations": {
      "guards": [
        "authenticated",
        "admin-only"
      ],
      "routes": [
        "admin-dashboard",
        "admin-orders",
        "admin-specialists",
        "specialist-detail",
        "order-assignment"
      ],
      "platforms": [
        "admin-app"
      ]
    }
  },
  "rawContent": "# Admin Role\n# Company administrators\n\n[role]\nid = \"eldercare-admin\"\nname = \"Administrator\"\ndescription = \"Company administrators managing orders and specialists\"\nlevel = 3\n\n[role.identification]\nmethod = \"phone\"\nrequired = true\nverification = \"sms-otp\"\n\n[permissions]\nlist = [\n  \"order:read:all\",\n  \"order:assign\",\n  \"order:update\",\n  \"specialist:create\",\n  \"specialist:read:all\",\n  \"specialist:update\",\n  \"specialist:activate\",\n  \"specialist:deactivate\",\n  \"availability:read:all\",\n  \"dashboard:view\"\n]\n\n[role.actions]\ncanDo = [\n  \"View all orders\",\n  \"Assign specialists to orders\",\n  \"Create and manage specialists\",\n  \"Activate/deactivate specialists\",\n  \"Define specialist service areas\",\n  \"View dashboard metrics\",\n  \"View specialist availability\"\n]\ncannotDo = [\n  \"Delete orders permanently\",\n  \"Access financial/accounting\",\n  \"Modify system settings\"\n]\n\n[relations]\nguards = [\"authenticated\", \"admin-only\"]\nroutes = [\"admin-dashboard\", \"admin-orders\", \"admin-specialists\", \"specialist-detail\", \"order-assignment\"]\nplatforms = [\"admin-app\"]\n",
  "metadata": {
    "size": 1051,
    "modified": "2025-12-14T14:11:46.444Z"
  }
}